{
  "protocol": "relay.client-read-model/v1",
  "view": "status",
  "source": "runtime-v2",
  "read_only": false,
  "status": {
    "run_id": "RUN-1", "source": "runtime-v2", "read_only": false,
    "host": "alive", "host_detail": "epoch:2",
    "ledger": { "run_status": "running", "group": "running", "progress": { "done": 1, "total": 2 }, "updated_at": "2026-08-21T10:00:00+08:00", "state_signature": "bbbbbbbbbbbbbbbbbbbbbbbbbbbbbbbbbbbbbbbbbbbbbbbbbbbbbbbbbbbbbbbb" },
    "events": 7
  },
  "detail": null
}
